{
  "repository": "Nord0rk/Dystopian-Wars-4.0",
  "commit": "b3f04598de52391ae1b3aad6b4ffd0d82126474a",
  "tree": "7e0dc04244f2bc7414b81220db2474f0379a5acf",
  "commitTimestamp": "2026-09-22T10:04:22Z",
  "files": [
    {
      "path": "Alliance.cat",
      "blob": "0c7732963c40996ef5c03607f2fc81b0cc510665",
      "bytes": 982306,
      "sha256": "027f9d2e067bdb579776fa761f2f9f822cef84329e9c25804c256339982cb0bf"
    },
    {
      "path": "Commonwealth.cat",
      "blob": "b804761006ca850bfc25d8f1924d65f5c93f279e",
      "bytes": 826473,
      "sha256": "bdee8d0a9fb622785146f6a15ecbeec44e6538f96ddc602ff06d5a352cf0fee9"
    },
    {
      "path": "Crown.cat",
      "blob": "4f757fd63e508530c1b1bc0c3c2a4bf3cb1406d2",
      "bytes": 759417,
      "sha256": "b38d6a9129e446632d8d5bb5542ff7bb6944c5ad19c0b3e30a9ee5c32904059e"
    },
    {
      "path": "Dystopian Wars 4.0.gst",
      "blob": "0bf45ed3c2dee0a3b0a9c79ea71a21a0456aac21",
      "bytes": 164969,
      "sha256": "afadc4d49126a3ca67b9ddece8c54cd5e9201889cf21df7257a787981ce92198"
    },
    {
      "path": "Empire.cat",
      "blob": "5d0f76985d89366c08953608f2047035d31ebaab",
      "bytes": 941100,
      "sha256": "3a36637b3bc21ac9e882fe2b3ed54f61c3df16375ece55b3454bb4605d923f00"
    },
    {
      "path": "Enlightened.cat",
      "blob": "793c545748db4a4ebc39aca1a1f45db6ef040070",
      "bytes": 672412,
      "sha256": "daaa71da2829ee19f902f78576e405786ed07e1b5e5a524a97bb2d963250f42f"
    },
    {
      "path": "Imperium.cat",
      "blob": "02b0e75e31b2b2ab60d592c7f71aba936b4daed1",
      "bytes": 719017,
      "sha256": "69bab822eb2ac41baa3593b4acbeed3a82fee9e1370665f49114fc498224b4e2"
    },
    {
      "path": "Rules Glossary.cat",
      "blob": "07fd0ac645f9dece726fb0f2af6bca77c338eb39",
      "bytes": 199008,
      "sha256": "15fd52886c45a05c3c7dc8f78208f83886e57c566ec6198d3cb7f85e9f7de4db"
    },
    {
      "path": "Sultanate.cat",
      "blob": "37ecdf07962d4b90c7d345ac9c38502a78b26284",
      "bytes": 776584,
      "sha256": "4c31755d1d820d5941ed09fd4aa2faf19a21d68cfd5453d528bbfae1cbde36b5"
    },
    {
      "path": "Union.cat",
      "blob": "bcdee0d4105100f3f8afc6548c2aa9fd71fc5950",
      "bytes": 746281,
      "sha256": "cce38797e30926c0e6781b2cf9bde42cce5f9a3c66b7d89c98e21f587df1f686"
    }
  ]
}
